Pharmacy Name,Address,City,Post Code,State,Phone,Home Delivery Service Available,Add my pharmacy to the Pharmacy Finder,Aranesp Pharmacy Contact,Aranesp Form Submission Date
Discount Drug Store Toowoomba Central,8 Mylne Street,Toowoomba,4350,QLD,07 4637 1888,Yes,Yes,Teddie Ziesemer,23/6/20 10:57
The Village Pharmacy Lindfield,19-21 Lindfield Avenue,Lindfield,2070,NSW,02 9416 7550,Yes,Yes,Sylvia Thai,23/6/20 10:55
Callister's Pharmacy,471 Glenferrie Road,Kooyong,3144,VIC,03 9822 2723,Yes,Yes,Robert Tieu,23/6/20 10:54
Manningham Pharmacy,"Suite 407, 200 High Street",Lower Templestowe,3107,VIC,03 8595 6868,No,Yes,Daniel Chen,23/6/20 10:53
Trinity Gardens Pharmacist Advice,214-216 Portrush Road,Trinity Gardens,5068,SA,08 8330 0070,Yes,Yes,Matthew Cervelli,23/6/20 10:52
McKinnon Pharmacy and Post Office,157 McKinnon Road,McKinnon,3204,VIC,03 9578 4516,Yes,Yes,David Wong,23/6/20 10:52
Discount Drug Store Bundaberg,128 Bourbong Street,Bundaberg,4670,QLD,07 4151 5533,Yes,Yes,Tanya Bowden,23/6/20 10:51
Cotham Road Pharmacy,118 Cotham Road,Kew,3101,VIC,03 9817 3676,Yes,Yes,Balsa Celebic,23/6/20 10:50
Healthpoint Rode Chemist,"Shop 10 & 11, 734 Rode Road",Stafford Heights,4053,QLD,07 3359 6717,Yes,Yes,Rode Pharmacy,23/6/20 10:50
Brunswick Pharmacy,369 Sydney Road,Brunswick,3056,VIC,03 9380 9118,Yes,Yes,Billy Tambassis - 9380 9118,23/6/20 10:48
Wizard Pharmacy Mosman Park,"Shop 11 & 12 Mosman Park Shopping Centre, 50 Harvey Street",Mosman Park,6012,WA,08 9384 5165,Yes,Yes,Ai Lian,23/6/20 10:46
23rd Avenue Chempro Chemist,"Shop 7 Palm Gardens Shopping Centre, Cnr Townson Avenue & Mawarra Street",Palm Beach,4221,QLD,07 5576 2866,Yes,Yes,karen,23/6/20 10:46
Pharmacy 4 Less Kotara,Shop 1A Kotara Homemaker Centre Cnr Kullaiba Road and Park Avenue,Kotara,2289,NSW,02 4957 1594,Yes,Yes,Boris Reztsov,23/6/20 10:46
Spiro Koutsis Pharmacy,925 High Street,Thornbury,3071,VIC,03 9484 1740,Yes,Yes,SPIRO KOUTSIS,23/6/20 10:42
Amcal Chermside Pharmacy,3/956 Gympie Road,Chermside,4032,QLD,07 3350 3637,Yes,Yes,07 3350 3637,23/6/20 10:42
Highpoint Medical Centre Pharmacy,"Shop 6005 Highpoint Shopping Centre, 120-200 Rosamond Road",Maribyrnong,3032,VIC,03 9317 8362,Yes,Yes,Thai Khuu,23/6/20 10:42
Hardings 24-hour Pharmacy Annerley,548 Ipswich Road,Annerley,4103,QLD,07 3892 1494,Yes,Yes,Chetna Patel,23/6/20 10:41
TerryWhite Chemmart Kardinya,"Shop 24 Kardinya Park Shopping Centre, South Street",Kardinya,6163,WA,08 9337 7051,Yes,Yes,893377051,23/6/20 10:40
Blooms the Chemist Medical Joondalup,5 Joondalup Gate,Edgewater,6027,WA,08 9301 2088,Yes,Yes,Andria Aird,14/7/20 10:00
Blooms the Chemist South West Rocks,Shops 9-10 Rocks Shopping Fair 255-279 Gregory Street,South West Rocks,2431,NSW,02 6566 6155,Yes,Yes,Craig Cooper,14/7/20 10:00
Blooms the Chemist Tamworth,348 Peel Street,Tamworth,2340,NSW,02 6766 2895,Yes,Yes,Bill Handley / Anna Anderson,14/7/20 10:00
Blooms the Chemist Toorak,459 Toorak Road,Toorak,3142,VIC,03 9826 1524,Yes,Yes,Candice Reynolds / Andrew Leslie,14/7/20 10:00
Blooms the Chemist North Perth,372 Fitzgerald Street,North Perth,6006,WA,08 9328 5762,Yes,Yes,Colin Willis,14/7/20 10:00
Blooms the Chemist Royal Randwick,"Shop 26, 73 Belmore Road",Randwick,2031,NSW,02 9398 1999,Yes,Yes,Rohit Uppal / Paul Sharman,14/7/20 10:00
Blooms the Chemist Surry Hills Crown Street,559 Crown Street,Surry Hills,2010,NSW,02 9310 2631,Yes,Yes,Andrew Yap,14/7/20 10:00
Rohit Day and Night (Blooms the Chemist Randwick Day and Night),10 Belmore Road,Randwick,2031,NSW,02 9398 1777,Yes,Yes,Rohit Uppal / Paul Sharman,14/7/20 10:00
Blooms the Chemist Casey Central,"Casey Central Shopping Centre, Shop 132-134, 400 Narre Warren-Cranbourne Road",Narre Warren South,3805,VIC,03 9704 8166,Yes,Yes,Joseph Mikhail (Pharmacist Manager)/Tim Sidgreaves,14/7/20 10:00
Blooms the Chemist Ballina,Shop 68 Corner Fox and Kerr Street,Ballina,2478,NSW,02 6686 9202,Yes,Yes,Claudia Sampson,14/7/20 10:00
Blooms the Chemist Toormina,"Shop Sp047 Toormina Gardens, 5 Toormina Road",Toormina,2452,NSW,02 6653 1444,Yes,Yes,Robert Van Wyk/Gautam Chauhan,14/7/20 10:00
Blooms the Chemist Windsor Kable Street,"Level 1, 1-12 Kable St",Windsor,2756,NSW,02 4573 8177,Yes,Yes,Theresa Nguyen / Margaret Chow,14/7/20 10:00
Blooms the Chemist Albury,491 Townsend Street,Albury,2640,NSW,02 6021 3255,Yes,Yes,Alyce Heffernan/Jason Holdstock,14/7/20 10:00
Blooms the Chemist Green Hills,Shop 1028 Stockland Green Hills,East Maitland,2323,NSW,02 4934 7078,Yes,Yes,Peter Green,14/7/20 10:00
Blooms the Chemist Port Coogee WA,"Shop T2 Port Coogee Village, 6 Calypso Parade",North Coogee,6163,WA,08 6166 4350,Yes,Yes,Andria Aird / Monty Kanungo,14/7/20 10:00
Blooms the Chemist Umina,"Umina Mall, Ocean Beach Road",Umina Beach,2257,NSW,02 4341 6906,Yes,Yes,Markos Atalla,14/7/20 10:00
Blooms the Chemist Windsor Riverview,"Shop 16-17 Riverview Shopping Centre, 227 George Street",Windsor,2756,NSW,02 4577 3265,Yes,Yes,Margaret Chow/ Theresa Nguyen,14/7/20 10:00
Blooms the Chemist Kenmore,"Kenmore Plaza Shopping Centre, 841 Moggill Road",Kenmore,4069,QLD,07 3378 5769,Yes,Yes,Hannah McTier,14/7/20 10:00
Blooms the Chemist Tweed City Central,Shop 115 Tweed City Shopping Centre,Tweed Heads South,2486,NSW,07 5524 4974,Yes,Yes,Craig Carson/Adam Lowe/Jayani Gnananathan,14/7/20 10:00
Blooms the Chemist Rosanna,108 Lower Plenty Road,Rosanna,3084,VIC,03 9458 1912,Yes,Yes,Shirin Jamaly / Malak (Mel) Abdallah,14/7/20 10:00
Blooms the Chemist Applecross Medical,"Woolworths Centre, Shop C01/857 Canning Highway",Mt Pleasant,6153,WA,08 9315 5131,Yes,Yes,Nada Clark,14/7/20 10:00
Blooms the Chemist Carrington,"Shop A, Pailing Court, Carrington Centennial Care, 90 Werombi Road",Grasmere,2570,NSW,02 4655 8857,Yes,Yes,Mylinh Pham / Albert Cabrera-Yee,14/7/20 10:00
Blooms the Chemist Rochedale,"Shop 5B, Rochedale Village, 329 Gardner Road",Rochedale,4123,QLD,07 3452 8948,Yes,Yes,David Buckley,14/7/20 10:00
Blooms the Chemist Albury West End,"Shops FC007-SP008 West End Plaza Shopping Centre, 487 Kiewa Street",Albury,2640,NSW,02 6021 3713,Yes,Yes,Alyce Heffernan/Jason Holdstock,14/7/20 10:00
Blooms the Chemist The Pines,"The Pines Shopping Centre, 22 K P McGrath Drive & Guineas Creek Road",Elanora,4221,QLD,07 5598 1415,Yes,Yes,Craig Carson/Adam Lowe/Jayani Gnananathan,14/7/20 10:00
Blooms the Chemist Sawtell,37 First Avenue,Sawtell,2452,NSW,02 6653 1227,Yes,Yes,Robert Van Wyk/Gautam Chauhan,14/7/20 10:00
Blooms the Chemist Wagga Marketplace,33 Forsyth Street,Wagga Wagga,2650,NSW,02 6931 7840,Yes,Yes,Candice Reynolds/Claire Gallaway/Krishun Kumar,14/7/20 10:00
Blooms the Chemist Padstow,57-59 Padstow Parade,Padstow,2211,NSW,02 9773 9427,Yes,Yes,David Tran / John Thorne,14/7/20 10:00
Blooms the Chemist Penrith Nepean Centro,Shop 39 Nepean Village Station Street,Penrith,2750,NSW,02 4732 1328,Yes,Yes,Audrey Lim,14/7/20 10:00
Blooms the Chemist Geraldton Fountains,113 Marine Terrace,Geraldton,6530,WA,08 9921 1755,Yes,Yes,Barbara Kirk,14/7/20 10:00
Blooms the Chemist Bull Creek,"Shop 7, Stockland Bullcreek Shopping Centre, Benningfield Road and South Street",Bull Creek,6149,WA,08 9332 3777,Yes,Yes,Anthony Masi,14/7/20 10:00